{
  "id": "L2-004",
  "level": "L2-check",
  "requirement": "spec/datum-v0.2.md#2-constraints",
  "normative": "MUST",
  "description": "a value outside a declared enumeration is a domain violation",
  "fixture": {
    "nodes": [
      {
        "id": "nd_7f3a2c",
        "type": "character",
        "label": "Rin",
        "branch": "main",
        "created_in": "cm_0044",
        "status": "canon"
      }
    ],
    "claims": [
      {
        "id": "cl_st01",
        "node": "nd_7f3a2c",
        "predicate": "status",
        "value": "alive",
        "effective": {
          "from": "ev_birth",
          "to": null
        },
        "authority": "binding",
        "provenance": {
          "source": "series-bible-v3",
          "asserted_by": "user:lenox",
          "commit": "cm_0044"
        },
        "status": "canon"
      }
    ],
    "commits": [
      {
        "id": "cm_0044",
        "parents": [],
        "author": "user:lenox",
        "authority": "binding",
        "message": "Establish Rin",
        "changes": [],
        "supersedes": []
      }
    ],
    "branches": [
      {
        "name": "main",
        "head": "cm_0044",
        "kind": "main"
      }
    ],
    "constraints": [
      {
        "type": "character",
        "kind": "domain",
        "predicate": "status",
        "values": [
          "alive",
          "dead",
          "missing"
        ],
        "severity": "blocking"
      }
    ]
  },
  "operation": {
    "tool": "datum.check",
    "principal": "agent:showrunner",
    "args": {
      "claims": [
        {
          "id": "cl_cand",
          "node": "nd_7f3a2c",
          "predicate": "status",
          "value": "ascended",
          "effective": {
            "from": "ev_birth",
            "to": null
          },
          "authority": "proposed",
          "provenance": {
            "source": "series-bible-v3",
            "asserted_by": "user:lenox",
            "commit": "cm_0044"
          },
          "status": "proposed"
        }
      ],
      "branch": "main",
      "scope": [
        "nd_7f3a2c"
      ]
    }
  },
  "expect": [
    {
      "path": "$.status",
      "op": "eq",
      "value": "conflict"
    },
    {
      "path": "$.violations[0].constraint",
      "op": "eq",
      "value": "domain"
    }
  ]
}
