{
  "id": "L2-009",
  "level": "L2-check",
  "requirement": "spec/datum-v0.2.md#2-constraints",
  "normative": "MUST",
  "description": "a lower-tier claim contradicting a higher-tier claim is advisory, not blocking",
  "fixture": {
    "nodes": [
      {
        "id": "nd_7f3a2c",
        "type": "character",
        "label": "Rin",
        "branch": "main",
        "created_in": "cm_0044",
        "status": "canon"
      }
    ],
    "claims": [
      {
        "id": "cl_9b21",
        "node": "nd_7f3a2c",
        "predicate": "eye_color",
        "value": "green",
        "effective": {
          "from": "ev_birth",
          "to": null
        },
        "authority": "binding",
        "provenance": {
          "source": "series-bible-v3",
          "asserted_by": "user:lenox",
          "commit": "cm_0044"
        },
        "status": "canon"
      },
      {
        "id": "cl_apoc",
        "node": "nd_7f3a2c",
        "predicate": "eye_color",
        "value": "violet",
        "effective": {
          "from": "ev_birth",
          "to": null
        },
        "authority": "apocryphal",
        "provenance": {
          "source": "series-bible-v3",
          "asserted_by": "user:lenox",
          "commit": "cm_0044"
        },
        "status": "apocryphal"
      }
    ],
    "commits": [
      {
        "id": "cm_0044",
        "parents": [],
        "author": "user:lenox",
        "authority": "binding",
        "message": "Establish Rin",
        "changes": [],
        "supersedes": []
      }
    ],
    "branches": [
      {
        "name": "main",
        "head": "cm_0044",
        "kind": "main"
      }
    ],
    "constraints": [
      {
        "type": "character",
        "kind": "cardinality",
        "predicate": "eye_color",
        "max": 1,
        "severity": "blocking"
      },
      {
        "type": "character",
        "kind": "authority",
        "severity": "advisory"
      }
    ]
  },
  "operation": {
    "tool": "datum.check",
    "principal": "agent:showrunner",
    "args": {
      "claims": [],
      "branch": "main",
      "scope": [
        "nd_7f3a2c"
      ]
    }
  },
  "expect": [
    {
      "path": "$.violations[*].severity",
      "op": "eq",
      "value": "advisory"
    }
  ],
  "rationale": "Two sources disagreeing is not automatically a conflict \u2014 it is a conflict only when they carry equal binding force. An implementation that treats apocrypha as conflicting makes every Legends continuity a blocking error, which is how the tool gets uninstalled."
}
