{
  "id": "L6-005",
  "level": "L6-federation",
  "requirement": "spec/datum-v0.2.md#83-federation-is-authority-scoped-imports--and-it-is-the-licensing-product",
  "normative": "MUST",
  "description": "a conflict crossing an import boundary is advisory and does not auto-resolve",
  "fixture": {
    "nodes": [
      {
        "id": "nd_7f3a2c",
        "type": "character",
        "label": "Rin",
        "branch": "main",
        "created_in": "cm_0044",
        "status": "canon"
      }
    ],
    "claims": [
      {
        "id": "cl_imp",
        "node": "nd_7f3a2c",
        "predicate": "eye_color",
        "value": "green",
        "effective": {
          "from": "ev_birth",
          "to": null
        },
        "authority": "binding",
        "provenance": {
          "source": "rightsholder:series-bible-v3",
          "asserted_by": "user:lenox",
          "commit": "cm_up01"
        },
        "status": "canon"
      }
    ],
    "commits": [
      {
        "id": "cm_up01",
        "parents": [],
        "author": "user:lenox",
        "authority": "binding",
        "message": "Upstream canon",
        "changes": [],
        "supersedes": []
      }
    ],
    "branches": [
      {
        "name": "main",
        "head": "cm_up01",
        "kind": "main"
      },
      {
        "name": "draft/licensee-scope",
        "head": "cm_up01",
        "kind": "draft"
      }
    ],
    "constraints": [
      {
        "type": "character",
        "kind": "cardinality",
        "predicate": "eye_color",
        "max": 1,
        "severity": "blocking"
      }
    ],
    "imports": [
      {
        "namespace": "rightsholder",
        "rights": {
          "read": true,
          "propose": true,
          "supersede_main": false,
          "supersede_scoped": true
        }
      }
    ]
  },
  "operation": {
    "tool": "datum.check",
    "principal": "user:licensee",
    "args": {
      "claims": [
        {
          "id": "cl_cand",
          "node": "nd_7f3a2c",
          "predicate": "eye_color",
          "value": "blue",
          "effective": {
            "from": "ev_birth",
            "to": null
          },
          "authority": "binding",
          "provenance": {
            "source": "licensee:spinoff-bible",
            "asserted_by": "user:lenox",
            "commit": "cm_up01"
          },
          "status": "proposed"
        }
      ],
      "branch": "main",
      "scope": [
        "nd_7f3a2c"
      ]
    }
  },
  "expect": [
    {
      "path": "$.violations[0].severity",
      "op": "eq",
      "value": "advisory"
    },
    {
      "path": "$.violations[0].auto_resolvable",
      "op": "eq",
      "value": false
    },
    {
      "path": "$.violations[0].escalates_to",
      "op": "exists",
      "note": "Escalation to the rights holder as a review item is the mechanism; an advisory that goes nowhere is a suppressed conflict."
    }
  ]
}
