{
  "id": "L4-003",
  "level": "L4-authority",
  "requirement": "spec/datum-v0.2.md#44-datumcommit",
  "normative": "MUST",
  "description": "commit rejects while any blocking violation is unresolved",
  "fixture": {
    "nodes": [
      {
        "id": "nd_7f3a2c",
        "type": "character",
        "label": "Rin",
        "branch": "main",
        "created_in": "cm_0044",
        "status": "canon"
      }
    ],
    "claims": [
      {
        "id": "cl_9b21",
        "node": "nd_7f3a2c",
        "predicate": "eye_color",
        "value": "green",
        "effective": {
          "from": "ev_birth",
          "to": null
        },
        "authority": "binding",
        "provenance": {
          "source": "series-bible-v3",
          "asserted_by": "user:lenox",
          "commit": "cm_0044"
        },
        "status": "canon"
      }
    ],
    "commits": [
      {
        "id": "cm_0044",
        "parents": [],
        "author": "user:lenox",
        "authority": "binding",
        "message": "Establish Rin",
        "changes": [],
        "supersedes": []
      }
    ],
    "branches": [
      {
        "name": "main",
        "head": "cm_0044",
        "kind": "main"
      }
    ],
    "constraints": [
      {
        "type": "character",
        "kind": "cardinality",
        "predicate": "eye_color",
        "max": 1,
        "severity": "blocking"
      }
    ]
  },
  "operation": {
    "tool": "datum.commit",
    "principal": "user:lenox",
    "args": {
      "into": "main",
      "authority": "binding",
      "message": "Rin has blue eyes",
      "changes": [
        {
          "op": "assert",
          "claim": "cl_bad",
          "node": "nd_7f3a2c",
          "predicate": "eye_color",
          "value": "blue"
        }
      ]
    }
  },
  "expect": [
    {
      "path": "$.status",
      "op": "eq",
      "value": "rejected"
    },
    {
      "path": "$.violations[0].severity",
      "op": "eq",
      "value": "blocking"
    }
  ]
}
