{
  "id": "L4-002",
  "level": "L4-authority",
  "requirement": "spec/datum-v0.2.md#43-datumpropose",
  "normative": "MUST",
  "description": "an agent principal may call datum.propose, and the result lands on a proposal branch",
  "fixture": {
    "nodes": [
      {
        "id": "nd_7f3a2c",
        "type": "character",
        "label": "Rin",
        "branch": "main",
        "created_in": "cm_0044",
        "status": "canon"
      }
    ],
    "claims": [
      {
        "id": "cl_9b21",
        "node": "nd_7f3a2c",
        "predicate": "eye_color",
        "value": "green",
        "effective": {
          "from": "ev_birth",
          "to": null
        },
        "authority": "binding",
        "provenance": {
          "source": "series-bible-v3",
          "asserted_by": "user:lenox",
          "commit": "cm_0044"
        },
        "status": "canon"
      }
    ],
    "commits": [
      {
        "id": "cm_0044",
        "parents": [],
        "author": "user:lenox",
        "authority": "binding",
        "message": "Establish Rin",
        "changes": [],
        "supersedes": []
      }
    ],
    "branches": [
      {
        "name": "main",
        "head": "cm_0044",
        "kind": "main"
      }
    ],
    "constraints": [
      {
        "type": "character",
        "kind": "cardinality",
        "predicate": "eye_color",
        "max": 1,
        "severity": "blocking"
      }
    ]
  },
  "operation": {
    "tool": "datum.propose",
    "principal": "agent:showrunner",
    "args": {
      "branch_from": "main",
      "author": "agent:showrunner",
      "rationale": "Established in Ep. 4 draft, needs ratification",
      "changes": [
        {
          "op": "assert",
          "node": "nd_7f3a2c",
          "predicate": "rank",
          "value": "Warden"
        }
      ]
    }
  },
  "expect": [
    {
      "path": "$.status",
      "op": "neq",
      "value": "forbidden"
    },
    {
      "path": "$.proposal_id",
      "op": "exists"
    },
    {
      "path": "$.verdict",
      "op": "exists",
      "note": "propose runs check pre-flight and returns the verdict alongside the proposal."
    },
    {
      "path": "$.branch",
      "op": "contains",
      "value": "proposal/"
    }
  ]
}
