{
  "id": "L6-001",
  "level": "L6-federation",
  "requirement": "spec/datum-v0.2.md#83-federation-is-authority-scoped-imports--and-it-is-the-licensing-product",
  "normative": "MUST",
  "description": "a licensee may read imported canon",
  "fixture": {
    "nodes": [
      {
        "id": "nd_7f3a2c",
        "type": "character",
        "label": "Rin",
        "branch": "main",
        "created_in": "cm_0044",
        "status": "canon"
      }
    ],
    "claims": [
      {
        "id": "cl_imp",
        "node": "nd_7f3a2c",
        "predicate": "eye_color",
        "value": "green",
        "effective": {
          "from": "ev_birth",
          "to": null
        },
        "authority": "binding",
        "provenance": {
          "source": "rightsholder:series-bible-v3",
          "asserted_by": "user:lenox",
          "commit": "cm_up01"
        },
        "status": "canon"
      }
    ],
    "commits": [
      {
        "id": "cm_up01",
        "parents": [],
        "author": "user:lenox",
        "authority": "binding",
        "message": "Upstream canon",
        "changes": [],
        "supersedes": []
      }
    ],
    "branches": [
      {
        "name": "main",
        "head": "cm_up01",
        "kind": "main"
      },
      {
        "name": "draft/licensee-scope",
        "head": "cm_up01",
        "kind": "draft"
      }
    ],
    "constraints": [
      {
        "type": "character",
        "kind": "cardinality",
        "predicate": "eye_color",
        "max": 1,
        "severity": "blocking"
      }
    ],
    "imports": [
      {
        "namespace": "rightsholder",
        "rights": {
          "read": true,
          "propose": true,
          "supersede_main": false,
          "supersede_scoped": true
        }
      }
    ]
  },
  "operation": {
    "tool": "datum.read",
    "principal": "user:licensee",
    "args": {
      "node_ids": [
        "nd_7f3a2c"
      ],
      "branch": "main"
    }
  },
  "expect": [
    {
      "path": "$.claims[?id=cl_imp].value",
      "op": "eq",
      "value": "green"
    }
  ]
}
